{
  "$schema": "../schemas/workspace-lease.schema.json",
  "id": "lease_...",
  "holder": "agent-a",
  "task": "Implement backend API",
  "scope": {
    "kind": "path",
    "patterns": ["src/api/**"]
  },
  "status": "requested",
  "created_at": "2026-01-01T00:00:00Z",
  "expires_at": "2026-01-01T02:00:00Z",
  "reason": ""
}
